### ISSUE TITLE
mDNS discovery binds to wrong interface

### ISSUE THREAD

**Issue by realloc** [hashicorp/serf#122]
mDSN discovery ignores 'bind' configuration option and uses first interface. It should use interface with 'bind' ip or it's own configuration option.

```
root@cc00:~# serf version
Serf v0.4.1
Agent Protocol: 3 (Understands back to: 1)
root@cc00:~# cat /etc/serf/serf_agent.json 
{"event_handlers":[],"tags":{"dc":"dev"},"discover":"dev.realloc.spb.ru","profile":"lan","snapshot_path":"/tmp/serf_snapshot","leave_on_terminate":true,"bind":"172.16.0.1:7946"}
root@cc00:~# ip a sh
1: lo: <LOOPBACK,UP,LOWER_UP> mtu 16436 qdisc noqueue state UNKNOWN 
    link/loopback 00:00:00:00:00:00 brd 00:00:00:00:00:00
    inet 127.0.0.1/8 scope host lo
    inet6 ::1/128 scope host 
       valid_lft forever preferred_lft forever
2: eth0: <BROADCAST,MULTICAST,UP,LOWER_UP> mtu 1500 qdisc pfifo_fast state UP qlen 1000
    link/ether 08:00:27:52:10:f4 brd ff:ff:ff:ff:ff:ff
    inet 10.0.2.15/24 brd 10.0.2.255 scope global eth0
    inet6 fe80::a00:27ff:fe52:10f4/64 scope link 
       valid_lft forever preferred_lft forever
3: eth1: <BROADCAST,MULTICAST,UP,LOWER_UP> mtu 1500 qdisc pfifo_fast state UP qlen 1000
    link/ether 08:00:27:1f:4b:23 brd ff:ff:ff:ff:ff:ff
    inet 192.168.5.4/24 brd 192.168.5.255 scope global eth1
    inet6 fe80::a00:27ff:fe1f:4b23/64 scope link 
       valid_lft forever preferred_lft forever
4: eth2: <BROADCAST,MULTICAST,UP,LOWER_UP> mtu 1500 qdisc pfifo_fast state UP qlen 1000
    link/ether 08:00:27:a5:29:41 brd ff:ff:ff:ff:ff:ff
    inet 172.16.0.1/24 brd 172.16.0.255 scope global eth2
    inet6 fe80::a00:27ff:fea5:2941/64 scope link 
       valid_lft forever preferred_lft forever
5: eth3: <BROADCAST,MULTICAST,UP,LOWER_UP> mtu 1500 qdisc pfifo_fast state UP qlen 1000
    link/ether 08:00:27:f9:61:f6 brd ff:ff:ff:ff:ff:ff
    inet 172.16.1.1/24 brd 172.16.1.255 scope global eth3
    inet6 fe80::a00:27ff:fef9:61f6/64 scope link 
       valid_lft forever preferred_lft forever

root@cc00:~# tcpdump -n -i eth0 -c 10
tcpdump: verbose output suppressed, use -v or -vv for full protocol decode
listening on eth0, link-type EN10MB (Ethernet), capture size 65535 bytes
14:39:30.657948 IP 10.0.2.15 > 224.0.0.22: igmp v3 report, 1 group record(s)
14:39:30.658026 IP6 fe80::a00:27ff:fe52:10f4 > ff02::16: HBH ICMP6, multicast listener report v2, 1 group record(s), length 28
14:39:35.662992 IP 10.0.2.15.37640 > 224.0.0.251.5353: 4175+ ANY (QM)? _serf_dev.realloc.spb.ru._tcp.local. (47)
14:39:35.662999 IP 10.0.2.2 > 10.0.2.15: ICMP time exceeded in-transit, length 63
14:39:35.663657 IP6 fe80::a00:27ff:fe52:10f4.49077 > ff02::fb.5353: 4175+ ANY (QM)? _serf_dev.realloc.spb.ru._tcp.local. (47)
14:39:35.663983 IP 10.0.2.15.37640 > 224.0.0.251.5353: 2151+ ANY (QM)? cc00._serf_dev.realloc.spb.ru._tcp.local. (52)
14:39:35.663986 IP 10.0.2.2 > 10.0.2.15: ICMP time exceeded in-transit, length 68
14:39:35.664193 IP6 fe80::a00:27ff:fe52:10f4.49077 > ff02::fb.5353: 2151+ ANY (QM)? cc00._serf_dev.realloc.spb.ru._tcp.local. (52)
14:39:35.664549 IP 10.0.2.15.37640 > 224.0.0.251.5353: 45483+ ANY (QM)? cc00._serf_dev.realloc.spb.ru._tcp.local. (52)
14:39:35.664776 IP 10.0.2.2 > 10.0.2.15: ICMP time exceeded in-transit, length 68
10 packets captured
10 packets received by filter
0 packets dropped by kernel

```
